{"equality_checks":[{"plan_json_pointer":"/case_id","result_json_pointer":"/case_id"},{"plan_json_pointer":"/dependency_mode","result_json_pointer":"/dependency_mode"},{"plan_json_pointer":"/execution_mode","result_json_pointer":"/execution_mode"},{"plan_json_pointer":"/path_preparation_policy","result_json_pointer":"/path_preparation_policy"},{"plan_json_pointer":"/run_limits","result_json_pointer":"/run_limits"},{"plan_json_pointer":"/strategy","result_json_pointer":"/strategy"},{"plan_json_pointer":"/transport/completion_semantics","result_json_pointer":"/completion_semantics"},{"plan_json_pointer":"/transport/mode","result_json_pointer":"/transport_mode"},{"plan_json_pointer":"/transport/wire_model","result_json_pointer":"/wire_model"},{"plan_json_pointer":"/units","result_json_pointer":"/units"}],"expected_status":"success","fixture_id":"explicit_group_dag","plan_file_sha256":"ec15a83469c92d82503af14375ca667b650692a7ec6995951a7a384da1af8fc7","plan_path":"plans/valid/explicit_group_dag.json","result_file_sha256":"4703236107562dfdbbaea0c9041fa62c5accfe2f971ef8e9976922013835118b","result_path":"results/success/explicit_group_dag.json","schema_version":"overlap4ocs-contract-pair/v1"}
