{"equality_checks":[{"plan_json_pointer":"/case_id","result_json_pointer":"/case_id"},{"plan_json_pointer":"/dependency_mode","result_json_pointer":"/dependency_mode"},{"plan_json_pointer":"/execution_mode","result_json_pointer":"/execution_mode"},{"plan_json_pointer":"/path_preparation_policy","result_json_pointer":"/path_preparation_policy"},{"plan_json_pointer":"/run_limits","result_json_pointer":"/run_limits"},{"plan_json_pointer":"/strategy","result_json_pointer":"/strategy"},{"plan_json_pointer":"/transport/completion_semantics","result_json_pointer":"/completion_semantics"},{"plan_json_pointer":"/transport/mode","result_json_pointer":"/transport_mode"},{"plan_json_pointer":"/transport/wire_model","result_json_pointer":"/wire_model"},{"plan_json_pointer":"/units","result_json_pointer":"/units"}],"expected_status":"success","fixture_id":"swot_overlap_earliest","plan_file_sha256":"d64710bc57c2ad9155132743e61d82a54160a15421e033640065b5309aa6770b","plan_path":"plans/valid/swot_overlap_earliest.json","result_file_sha256":"8f8c2f7c97dd40b3ab2fb1393b54d3adb38d8bff3c8a47829d3876c2b4718dd1","result_path":"results/success/swot_overlap_earliest.json","schema_version":"overlap4ocs-contract-pair/v1"}
