{"equality_checks":[{"plan_json_pointer":"/case_id","result_json_pointer":"/case_id"},{"plan_json_pointer":"/dependency_mode","result_json_pointer":"/dependency_mode"},{"plan_json_pointer":"/execution_mode","result_json_pointer":"/execution_mode"},{"plan_json_pointer":"/path_preparation_policy","result_json_pointer":"/path_preparation_policy"},{"plan_json_pointer":"/run_limits","result_json_pointer":"/run_limits"},{"plan_json_pointer":"/strategy","result_json_pointer":"/strategy"},{"plan_json_pointer":"/transport/completion_semantics","result_json_pointer":"/completion_semantics"},{"plan_json_pointer":"/transport/mode","result_json_pointer":"/transport_mode"},{"plan_json_pointer":"/transport/wire_model","result_json_pointer":"/wire_model"},{"plan_json_pointer":"/units","result_json_pointer":"/units"}],"expected_status":"success","fixture_id":"global_step_barrier","plan_file_sha256":"21800b1138ca857ac8fbb816aef260d76e0888efb57c1974cf52c0b76868b728","plan_path":"plans/valid/global_step_barrier.json","result_file_sha256":"b9f188ebb4b5e90522b30ed1cfb41f79294cd4644d9c216d69b36c7703f19a26","result_path":"results/success/global_step_barrier.json","schema_version":"overlap4ocs-contract-pair/v1"}
