{"equality_checks":[{"plan_json_pointer":"/case_id","result_json_pointer":"/case_id"},{"plan_json_pointer":"/dependency_mode","result_json_pointer":"/dependency_mode"},{"plan_json_pointer":"/execution_mode","result_json_pointer":"/execution_mode"},{"plan_json_pointer":"/path_preparation_policy","result_json_pointer":"/path_preparation_policy"},{"plan_json_pointer":"/run_limits","result_json_pointer":"/run_limits"},{"plan_json_pointer":"/strategy","result_json_pointer":"/strategy"},{"plan_json_pointer":"/transport/completion_semantics","result_json_pointer":"/completion_semantics"},{"plan_json_pointer":"/transport/mode","result_json_pointer":"/transport_mode"},{"plan_json_pointer":"/transport/wire_model","result_json_pointer":"/wire_model"},{"plan_json_pointer":"/units","result_json_pointer":"/units"}],"expected_status":"success","fixture_id":"two_groups_same_epoch_independent_release","plan_file_sha256":"93c59957268ca30f3aae67ac7d3fb7e48788dc16a50bab8cf12667e985f89074","plan_path":"plans/valid/two_groups_same_epoch_independent_release.json","result_file_sha256":"6ac183bbdbfa110d5c7f5fd61c8218ee939680a63ac45ba59c01810436100f98","result_path":"results/success/two_groups_same_epoch_independent_release.json","schema_version":"overlap4ocs-contract-pair/v1"}
