{"equality_checks":[{"plan_json_pointer":"/case_id","result_json_pointer":"/case_id"},{"plan_json_pointer":"/dependency_mode","result_json_pointer":"/dependency_mode"},{"plan_json_pointer":"/execution_mode","result_json_pointer":"/execution_mode"},{"plan_json_pointer":"/path_preparation_policy","result_json_pointer":"/path_preparation_policy"},{"plan_json_pointer":"/run_limits","result_json_pointer":"/run_limits"},{"plan_json_pointer":"/strategy","result_json_pointer":"/strategy"},{"plan_json_pointer":"/transport/completion_semantics","result_json_pointer":"/completion_semantics"},{"plan_json_pointer":"/transport/mode","result_json_pointer":"/transport_mode"},{"plan_json_pointer":"/transport/wire_model","result_json_pointer":"/wire_model"},{"plan_json_pointer":"/units","result_json_pointer":"/units"}],"expected_status":"success","fixture_id":"exact_tail","plan_file_sha256":"75c9b486362da52757cf755646330a20b477ee33040838697e79711299264798","plan_path":"plans/valid/exact_tail.json","result_file_sha256":"3c6d9e9b0aa41a8d01a671febb07e7e97abf579ee68bea9402148c1afd6f589a","result_path":"results/success/exact_tail.json","schema_version":"overlap4ocs-contract-pair/v1"}
