{"equality_checks":[{"plan_json_pointer":"/case_id","result_json_pointer":"/case_id"},{"plan_json_pointer":"/dependency_mode","result_json_pointer":"/dependency_mode"},{"plan_json_pointer":"/execution_mode","result_json_pointer":"/execution_mode"},{"plan_json_pointer":"/path_preparation_policy","result_json_pointer":"/path_preparation_policy"},{"plan_json_pointer":"/run_limits","result_json_pointer":"/run_limits"},{"plan_json_pointer":"/strategy","result_json_pointer":"/strategy"},{"plan_json_pointer":"/transport/completion_semantics","result_json_pointer":"/completion_semantics"},{"plan_json_pointer":"/transport/mode","result_json_pointer":"/transport_mode"},{"plan_json_pointer":"/transport/wire_model","result_json_pointer":"/wire_model"},{"plan_json_pointer":"/units","result_json_pointer":"/units"}],"expected_status":"success","fixture_id":"one_shot_static_preinstalled","plan_file_sha256":"3b1075362a721c6641da6f4ccdfd7da3430f7e1859b850ee980211e41477cfc9","plan_path":"plans/valid/one_shot_static_preinstalled.json","result_file_sha256":"90efda1b44b9384f4b568a4ecf25b61fba58ecdbc3c56f5b39816400db38c39f","result_path":"results/success/one_shot_static_preinstalled.json","schema_version":"overlap4ocs-contract-pair/v1"}
