{"equality_checks":[{"plan_json_pointer":"/case_id","result_json_pointer":"/case_id"},{"plan_json_pointer":"/dependency_mode","result_json_pointer":"/dependency_mode"},{"plan_json_pointer":"/execution_mode","result_json_pointer":"/execution_mode"},{"plan_json_pointer":"/path_preparation_policy","result_json_pointer":"/path_preparation_policy"},{"plan_json_pointer":"/run_limits","result_json_pointer":"/run_limits"},{"plan_json_pointer":"/strategy","result_json_pointer":"/strategy"},{"plan_json_pointer":"/transport/completion_semantics","result_json_pointer":"/completion_semantics"},{"plan_json_pointer":"/transport/mode","result_json_pointer":"/transport_mode"},{"plan_json_pointer":"/transport/wire_model","result_json_pointer":"/wire_model"},{"plan_json_pointer":"/units","result_json_pointer":"/units"}],"expected_status":"success","fixture_id":"payload_5gib","plan_file_sha256":"13edf644d07130ddc7c17abdcdf2c63afe75d7a67f5e7fea7bb1dc8821fba23f","plan_path":"plans/valid/payload_5gib.json","result_file_sha256":"2e1cc381958fecefcd41d714d3e9cac6f092a2004534c7d1abe9ecc316abceac","result_path":"results/success/payload_5gib.json","schema_version":"overlap4ocs-contract-pair/v1"}
