{"equality_checks":[{"plan_json_pointer":"/case_id","result_json_pointer":"/case_id"},{"plan_json_pointer":"/dependency_mode","result_json_pointer":"/dependency_mode"},{"plan_json_pointer":"/execution_mode","result_json_pointer":"/execution_mode"},{"plan_json_pointer":"/path_preparation_policy","result_json_pointer":"/path_preparation_policy"},{"plan_json_pointer":"/run_limits","result_json_pointer":"/run_limits"},{"plan_json_pointer":"/strategy","result_json_pointer":"/strategy"},{"plan_json_pointer":"/transport/completion_semantics","result_json_pointer":"/completion_semantics"},{"plan_json_pointer":"/transport/mode","result_json_pointer":"/transport_mode"},{"plan_json_pointer":"/transport/wire_model","result_json_pointer":"/wire_model"},{"plan_json_pointer":"/units","result_json_pointer":"/units"}],"expected_status":"success","fixture_id":"one_plane_one_group","plan_file_sha256":"1eacbbbc4c956e412df1d158e1ad609aeb0ca010388e7e3e1634b98c91d509d4","plan_path":"plans/valid/one_plane_one_group.json","result_file_sha256":"1844d557594d46b377c3d03b85d86aa185bd05dd0b71b1aa9fa1e7209cf5bda7","result_path":"results/success/one_plane_one_group.json","schema_version":"overlap4ocs-contract-pair/v1"}
