{"equality_checks":[{"plan_json_pointer":"/case_id","result_json_pointer":"/case_id"},{"plan_json_pointer":"/dependency_mode","result_json_pointer":"/dependency_mode"},{"plan_json_pointer":"/execution_mode","result_json_pointer":"/execution_mode"},{"plan_json_pointer":"/path_preparation_policy","result_json_pointer":"/path_preparation_policy"},{"plan_json_pointer":"/run_limits","result_json_pointer":"/run_limits"},{"plan_json_pointer":"/strategy","result_json_pointer":"/strategy"},{"plan_json_pointer":"/transport/completion_semantics","result_json_pointer":"/completion_semantics"},{"plan_json_pointer":"/transport/mode","result_json_pointer":"/transport_mode"},{"plan_json_pointer":"/transport/wire_model","result_json_pointer":"/wire_model"},{"plan_json_pointer":"/units","result_json_pointer":"/units"}],"expected_status":"success","fixture_id":"sparse_permutation_without_fake_flow","plan_file_sha256":"f42f1a03f226e45c9f3f7917816f2fad8cae89f24389c861bcd6280609341d80","plan_path":"plans/valid/sparse_permutation_without_fake_flow.json","result_file_sha256":"3518c7e04687519b07437277c05bc337c25845f5e85c0e86a48c9f62917a9b95","result_path":"results/success/sparse_permutation_without_fake_flow.json","schema_version":"overlap4ocs-contract-pair/v1"}
