{"equality_checks":[{"plan_json_pointer":"/case_id","result_json_pointer":"/case_id"},{"plan_json_pointer":"/dependency_mode","result_json_pointer":"/dependency_mode"},{"plan_json_pointer":"/execution_mode","result_json_pointer":"/execution_mode"},{"plan_json_pointer":"/path_preparation_policy","result_json_pointer":"/path_preparation_policy"},{"plan_json_pointer":"/run_limits","result_json_pointer":"/run_limits"},{"plan_json_pointer":"/strategy","result_json_pointer":"/strategy"},{"plan_json_pointer":"/transport/completion_semantics","result_json_pointer":"/completion_semantics"},{"plan_json_pointer":"/transport/mode","result_json_pointer":"/transport_mode"},{"plan_json_pointer":"/transport/wire_model","result_json_pointer":"/wire_model"},{"plan_json_pointer":"/units","result_json_pointer":"/units"}],"expected_status":"success","fixture_id":"reconfigure_new_generation","plan_file_sha256":"16ca82bc9d6dd1d93746f56a07302260abc42df938af8afc82b671d118417f7e","plan_path":"plans/valid/reconfigure_new_generation.json","result_file_sha256":"cb109f628c224d63a5562c92685b3dbffd78358514f138f50c31ba7b7ace6c37","result_path":"results/success/reconfigure_new_generation.json","schema_version":"overlap4ocs-contract-pair/v1"}
