{"equality_checks":[{"plan_json_pointer":"/case_id","result_json_pointer":"/case_id"},{"plan_json_pointer":"/dependency_mode","result_json_pointer":"/dependency_mode"},{"plan_json_pointer":"/execution_mode","result_json_pointer":"/execution_mode"},{"plan_json_pointer":"/path_preparation_policy","result_json_pointer":"/path_preparation_policy"},{"plan_json_pointer":"/run_limits","result_json_pointer":"/run_limits"},{"plan_json_pointer":"/strategy","result_json_pointer":"/strategy"},{"plan_json_pointer":"/transport/completion_semantics","result_json_pointer":"/completion_semantics"},{"plan_json_pointer":"/transport/mode","result_json_pointer":"/transport_mode"},{"plan_json_pointer":"/transport/wire_model","result_json_pointer":"/wire_model"},{"plan_json_pointer":"/units","result_json_pointer":"/units"}],"expected_status":"success","fixture_id":"baseline_step_lockstep","plan_file_sha256":"5d162e36fca168151d983c0e8f575ffe6699626282e360e357405fc2476591d0","plan_path":"plans/valid/baseline_step_lockstep.json","result_file_sha256":"97fce3788594233caec28db48268fb23545b6048dfd4afe919ef486f3bb00214","result_path":"results/success/baseline_step_lockstep.json","schema_version":"overlap4ocs-contract-pair/v1"}
