{"equality_checks":[{"plan_json_pointer":"/case_id","result_json_pointer":"/case_id"},{"plan_json_pointer":"/dependency_mode","result_json_pointer":"/dependency_mode"},{"plan_json_pointer":"/execution_mode","result_json_pointer":"/execution_mode"},{"plan_json_pointer":"/path_preparation_policy","result_json_pointer":"/path_preparation_policy"},{"plan_json_pointer":"/run_limits","result_json_pointer":"/run_limits"},{"plan_json_pointer":"/strategy","result_json_pointer":"/strategy"},{"plan_json_pointer":"/transport/completion_semantics","result_json_pointer":"/completion_semantics"},{"plan_json_pointer":"/transport/mode","result_json_pointer":"/transport_mode"},{"plan_json_pointer":"/transport/wire_model","result_json_pointer":"/wire_model"},{"plan_json_pointer":"/units","result_json_pointer":"/units"}],"expected_status":"success","fixture_id":"retain_new_epoch_same_generation","plan_file_sha256":"75375beaf243a8346b5a5bb91421e6c7947d585d18be6fc9b5c8262822aa574f","plan_path":"plans/valid/retain_new_epoch_same_generation.json","result_file_sha256":"c6d0de95e6f57294fd7e54784a5bbd70140ec2543b0e70cb12c44b892c647ca0","result_path":"results/success/retain_new_epoch_same_generation.json","schema_version":"overlap4ocs-contract-pair/v1"}
